{
  "kind": "blacknode.workflow",
  "schema_version": 1,
  "name": "Python Tool Agent",
  "saved_at": "2026-05-20T00:00:00",
  "entrypoint": {
    "node_id": "out",
    "port": "value"
  },
  "metadata": {
    "template": true,
    "description": "web_search collected by ToolBox and used by AgentLoop",
    "color": "#14b8a6"
  },
  "node_meta": {
    "model": {
      "id": "model",
      "type": "Model",
      "params": {
        "value": "claude-sonnet-4-6"
      },
      "pos": [
        60,
        60
      ],
      "inputs": [],
      "outputs": [
        "value"
      ],
      "input_types": {},
      "output_types": {
        "value": "Model"
      },
      "input_defaults": {}
    },
    "system": {
      "id": "system",
      "type": "Text",
      "params": {
        "value": "You are an agent. Use web_search when outside context would help."
      },
      "pos": [
        60,
        210
      ],
      "inputs": [],
      "outputs": [
        "value"
      ],
      "input_types": {},
      "output_types": {
        "value": "Text"
      },
      "input_defaults": {}
    },
    "task": {
      "id": "task",
      "type": "Text",
      "params": {
        "value": "Use web_search to learn what NVIDIA NIM is, then answer in one sentence."
      },
      "pos": [
        60,
        380
      ],
      "inputs": [],
      "outputs": [
        "value"
      ],
      "input_types": {},
      "output_types": {
        "value": "Text"
      },
      "input_defaults": {}
    },
    "tool": {
      "id": "tool",
      "type": "PythonFn",
      "params": {
        "code": "def run(query: str) -> str:\n    import html\n    import json\n    import re\n    import urllib.parse\n    import urllib.request\n\n    encoded = urllib.parse.quote_plus(str(query))\n\n    def fetch(url: str) -> str:\n        req = urllib.request.Request(url, headers={\"User-Agent\": \"Mozilla/5.0 Blacknode/1.0\"})\n        with urllib.request.urlopen(req, timeout=12) as resp:\n            return resp.read().decode(\"utf-8\", errors=\"replace\")\n\n    def clean(value: str) -> str:\n        value = re.sub(r\"<[^>]+>\", \" \", value)\n        value = html.unescape(value)\n        return re.sub(r\"\\s+\", \" \", value).strip()\n\n    try:\n        instant_url = \"https://api.duckduckgo.com/?q=\" + encoded + \"&format=json&no_html=1&skip_disambig=1\"\n        data = json.loads(fetch(instant_url))\n        for key in (\"AbstractText\", \"Definition\", \"Answer\"):\n            text = clean(str(data.get(key) or \"\"))\n            if text:\n                return text\n\n        pending = list(data.get(\"RelatedTopics\", []))\n        while pending:\n            item = pending.pop(0)\n            pending.extend(item.get(\"Topics\", []))\n            text = clean(str(item.get(\"Text\") or \"\"))\n            if text:\n                return text\n    except Exception:\n        pass\n\n    page = fetch(\"https://duckduckgo.com/html/?q=\" + encoded)\n    titles = [clean(match) for match in re.findall(r'<a[^>]+class=\"result__a\"[^>]*>(.*?)</a>', page, re.I | re.S)]\n    snippets = [\n        clean(a or b)\n        for a, b in re.findall(\n            r'<a[^>]+class=\"result__snippet\"[^>]*>(.*?)</a>|<div[^>]+class=\"result__snippet\"[^>]*>(.*?)</div>',\n            page,\n            re.I | re.S,\n        )\n    ]\n    results = []\n    for i, title in enumerate(titles[:3]):\n        if not title:\n            continue\n        snippet = snippets[i] if i < len(snippets) else \"\"\n        results.append(str(i + 1) + \". \" + title + ((\" - \" + snippet) if snippet else \"\"))\n    return \"\\n\".join(results) if results else \"No web snippets found for: \" + str(query)\n",
        "name": "web_search",
        "description": "Search DuckDuckGo and return a compact answer or top snippets.",
        "label": "web_search"
      },
      "pos": [
        360,
        80
      ],
      "inputs": [
        "code",
        "name",
        "description"
      ],
      "outputs": [
        "fn"
      ],
      "input_types": {
        "code": "Text",
        "name": "Text",
        "description": "Text"
      },
      "output_types": {
        "fn": "Fn"
      },
      "input_defaults": {}
    },
    "box": {
      "id": "box",
      "type": "ToolBox",
      "params": {},
      "pos": [
        620,
        110
      ],
      "inputs": [
        "tool_1"
      ],
      "outputs": [
        "tools"
      ],
      "input_types": {
        "tool_1": "Fn"
      },
      "output_types": {
        "tools": "List"
      },
      "input_defaults": {}
    },
    "loop": {
      "id": "loop",
      "type": "AgentLoop",
      "params": {
        "max_iter": 3
      },
      "pos": [
        620,
        280
      ],
      "inputs": [
        "prompt",
        "system",
        "model",
        "tools",
        "max_tokens",
        "max_iter"
      ],
      "outputs": [
        "result",
        "steps"
      ],
      "input_types": {
        "prompt": "Text",
        "system": "Text",
        "model": "Model",
        "tools": "List",
        "max_tokens": "Int",
        "max_iter": "Int"
      },
      "output_types": {
        "result": "Text",
        "steps": "List"
      },
      "input_defaults": {
        "model": "claude-sonnet-4-6",
        "max_tokens": 1024,
        "max_iter": 5
      }
    },
    "out": {
      "id": "out",
      "type": "Output",
      "params": {},
      "pos": [
        900,
        280
      ],
      "inputs": [
        "value"
      ],
      "outputs": [],
      "input_types": {
        "value": "Any"
      },
      "output_types": {},
      "input_defaults": {}
    }
  },
  "edges": [
    {
      "from": "model",
      "from_port": "value",
      "to": "loop",
      "to_port": "model"
    },
    {
      "from": "system",
      "from_port": "value",
      "to": "loop",
      "to_port": "system"
    },
    {
      "from": "task",
      "from_port": "value",
      "to": "loop",
      "to_port": "prompt"
    },
    {
      "from": "tool",
      "from_port": "fn",
      "to": "box",
      "to_port": "tool_1"
    },
    {
      "from": "box",
      "from_port": "tools",
      "to": "loop",
      "to_port": "tools"
    },
    {
      "from": "loop",
      "from_port": "result",
      "to": "out",
      "to_port": "value"
    }
  ]
}
